firm_name,business_type,address,reply
Isaac Firth & Sons,Worsted Spinners and Manufacturers,"Square Road Mill, near Halifax","Our works are situated near to the Hebble, a tributary of the Calder. Employ 121 hands. Rateable value of works, 300l. Our works are not affected by floods. Obtain supply of water jointly from springs and from the Halifax Corporation Waterworks. The whole of the the waste liquid produced at our works flows direct into sewers, and thence into the stream. Do not use any dyewares or bleaching materials. Use yearly Gallipoli oil, but no soap, alkali, or urine. The soapsuds are not treated for the recovery of grease. Consume yearly about 1,400 tons of coal, the ashes from which are carted to the railway to be used for ballast. The excrements of our workpeople are removed in barrels, and used for manure. Have no suggestions to offer."
Baldwin & Walker,Worsted Spinners,"West Croft Mills, Kings Cross, Halifax","Our works are situated near to the Hebble, a tributary of the Calder. Employ 107 hands. Rateable value of works, 416l. 5s. Obtain supply of water jointly from wells and from the Halifax Corporation Waterworks; and consume yearly 1,300 packs of goods of the value of 28,000. The whole of the liquid refuse produced at our works, except soapsuds, flows into sewers, and thence into the stream. Do not use any dyewares or bleaching materials. Use yearly two packs of soap. The waste wood produced in carding is sold and carted away. Use yearly about five packs of soft soap. The soapsuds are treated for the recovery of grease. Use steam 150 nominal horse-power. Consume yearly 800 tons of coal; the ashes from which are carted away from the premises to various ""tips"". The excrements of our workpeople are taken away in barrels to be used for manure. No suggestions to offer."
Lister & Company,Silk Spinners and Weavers,"Wellington Mills, Lower Wade Street, Halifax","Our works are situated near to the Hebble, a tributary of the Calder. Employ 400 hands. Rateable value of works, 752l. 10s. Our works are not affected by floods. Obtain supply of water jointly from wells and the Halifax Corporation Waterworks. Manufacture yearly 104,000 lbs. of goods of the value of 100,000. The whole of the waste liquid produced, except soapsuds, flows into sewers, and thence into the stream. Do not use any dyewares, bleaching materials, or oil. We purchase soapsuds and recover the grease, and obtain by the process 200l. a year. Use steam, 90 nominal horse-power. Consume yearly 3,000 tons of coal, the ashes from which are carted away and used for building purposes. The excrements of our workpeople are conveyed by waterclosets into sewers, and thence into the stream."
Samuel Lister,Worsted Spinner,"Park Mill, Halifax","My works are situated on the Hebble, a tributary of the Calder. Employ 80 hands. Rateable value of works, 250l. The bed of the stream has silted up. My works are not affected by floods. The river is polluted by works above; not by mines. Obtain supply of water from a well on my own premises, but do not know the annual consumption at my works. I spin yearly 150,000 lbs. of goods, of the value of 1000l. The whole of the waste liquid produced at my works flows direct into sewers, and thence into the stream. Do not use any dyewares or bleaching materials. Use yearly 700 gallons of oil, of the value of 120l. Produce yearly about 8,000 lbs. of waste wood in the process of carding, which is sold to oil and grease extractors. Use yearly 20,000 lbs. of soap. The soapsuds are sold to a grease extractor for 20l. a year. Use steam, 20 nominal horse-power. Consume yearly 500 tons of coal, the ashes from which are carted to the railway to be used for ballast. The excrements of our workpeople flow into sewers and thence into the stream. Have no suggestions to offer."
John Holdsworth & Company,Worsted Manufacturers,"Shaw Lodge Mills, Halifax","Our works are situated on a tributary of the Calder. Employ 3,000 hands. Rateable value of works, 3,000l. The bed of the river has silted up, caused by the pouring in of sewage by the Corporation and mill owners, also by ashes, dyewares, and other filth thrown into the stream. Our works are affected by floods, and considerable damage is often done to them. Within our recollection the stream has comparatively pure; now it is nothing better than disgusting swamps, polluted by every kind of manufacturing refuse, and by town sewage; but we are not aware whether it is polluted by mines. Obtain supply of water jointly from the stream, canal, wells, and Corporation waterworks. Our consumption is very large, but are not able to state the volume used at our works. If the river or stream from which we might derive a supply of water were rendered clear and unpolluted, it would be of very great money value to us, and we use every year a considerable sum. We manufacture yearly goods of the value from 200,000l. to 250,000l. The whole of the liquid refuse produced at our works, with exception of soapsuds, flows direct into the stream. Use yearly 50 tons of Gallipoli oil, of the value of 2,500l. The whole of the waste wool produced in carding is sold to woollen manufacturers. We use yearly, soap of the value of 1,000. The soapsuds are treated for the recovery of the grease, by which we gain yearly 120l. Use steam 240 nominal horse-power. Consume yearly about 7,000 tons of coal, the ashes from which are carted away from our premises. The excrements of our workpeople are partly carted away by farmers for manure, and are partly used on our own land. We see no means of avoiding pollution in future, that all solid and liquid refuse from manufactories, mills, and works, should be kept out of rivers and streams as far as practicable; that the turning in of this pollution be made known, and that the offender be fined on conviction. We have no special suggestions to offer as to the conservancy of rivers and streams, only that municipal corporations should not form a board of conservators."
Cyrus Brook & Company,Worsted Manufacturers,"Victoria Street East, North Gate, Halifax","Our works are situated near the Hebble, a tributary of the Calder. Employ 200 hands. Rateable value of works, 370l. 5s. Our works are not affected by floods. The condition of the stream is much the same as it always has been within our recollection. It is polluted by works above, but not by mines. Obtain supply of water partly from Halifax Corporation Waterworks, the remainder from wells, and consume yearly 2,500,000 gallons. Manufacture yearly 1,164,800 lbs. of goods; of the value 1,164l. The liquid refuse produced at our works flows direct into sewers, and then into the stream. Do not use any dyes or bleaching materials. Use yearly, soap 50 packs. The soapsuds are not treated for the recovery of the grease. Use steam, 200 nominal horse-power. Consume yearly 1,450 tons of coal, the ashes from which are used for filling up hollow places on waste land. The excrements of our workpeople flow into the brook, and thence into the stream. Have no suggestions to offer."
Benjamin Mellor & Sons,Woollen Manufacturers,"Holywell Mills, near Halifax","Our works are situated on the Carr Hall Brook, an affluent of the Calder. Employ 120 hands. Rateable value of works, 551l. 8s. The bed of the stream has not silted up. Our works are not affected by floods. The stream is comparatively clear, it is not polluted by works above, nor by mines. Obtain supply of water principally from springs, but partly from Carr Hall Brook, but are not able to state the annual consumption at our works. We manufacture yearly about 200,000 lbs. of goods, of the value of 36,404l. The whole of the waste liquid produced at our works flows into depositing tanks, and thence by pipes into the river. Use yearly, 25 tons of dyewares, principally logwood, sumac, and the like. The liquid dye waste is sent into the river. We do not use any bleaching materials. Use yearly Gallipoli oil, of the value of 1,000l, about 20 tons of patent oil of the value of 500l. Produce 20 tons of waste from the process. Use yearly, tons of soap, alkali, and urine. The soapsuds are treated for the recovery of the grease, by which we gain 261l. Use steam, 40 nominal horse-power. Consume yearly upwards of 2,000 tons of coal, the ashes from which are used for repairing roads. The excrements of our workpeople are removed and mixed with ashes, and used for manure in future, or as to the conservancy of rivers and streams."
Saml. Eagleston,Woollen and Worsted Manufacturer,"Saville Mill, Saville Park Road, Halifax","My works are situated near the Calder. Employ 74 hands. Rateable value of works, 450l. My works are not affected by floods. Obtain supply of water partly from wells and from Waterworks Company; and consume yearly 900,000 gallons. Manufacture yearly 150 tons of goods, of the value of 50,000l. The whole of the liquid refuse produced at my works flows into sewers, and then into the river. Do not use either dyes or wares or bleaching materials. Use yearly 1,000 gallons of cloth oil, of the value of 150l. Do not use either soap, alkali, or urine. Use steam, 16 nominal horse-power. Consume yearly 600 tons of coal, the ashes from which are used to repair roads. The excrements of my workpeople are carted away for manure. Have no special suggestions to offer."
Bancroft & Wilcox,Worsted Weavers,"Cross Hill Mill, Halifax","Our works are situated on the Calder. Employ 49 hands. Rateable value of works, 40l. We hire power and from Messrs. Edleston, and therefore are unable to state the volume of water consumed, steam-power used, the coal consumed, or what is done with the refuse. We manufacture yearly 150,000 lbs. of goods, of the value of 24l. The whole of the liquid refuse produced at our works flows into sewers, and thence into the river. Do not use any dye wares or bleaching materials, soap, alkali, or urine. The excrements of our workpeople are removed and used as manure. Have no suggestions to offer."
"Scarborough Bros., & Oakes",Worsted Spinners,"Trafalgar Works, West Croft Mills, Halifax","Our works are situated near to the Hebble, a tributary of the Calder. Employ 300 hands. Rateable value of works, 420l. The bed of the stream has not silted up. Our works are not affected by floods. The river is seriously polluted, and is black in colour, caused by refuse from other works thrown into it, and it has always been in this condition within our knowledge; it is not polluted by mines. Obtain supply of water partly from wells and from Waterworks Company. Consume yearly about 2,000,000 gallons. Manufacture yearly 800,000 lbs. of goods, of the value of 160,000l. The whole of the waste liquid produced at our works flows into sewers, and thence into the river. Do not use either dye wares or bleaching materials. Use yearly 2 tons of Gallipoli oil, of the value of 115l. Use yearly 50 packs of soap; no alkali or urine. The soapsuds are not treated for the recovery of grease. Use steam, 60 nominal horse-power. Consume yearly 500 tons of coal; make about 50 tons of ashes, which are used for repairing roads. The excrements of our workpeople are conveyed by water-closets into sewers, and thence into the river. We cannot see how pollution of the stream can be prevented without interfering with the trade of the district, and we are of opinion that if the bed of Hebble Brook was paved and inverted, it is, so as to reduce the waterway by narrowing the channel, and thereby causing the water to flow more rapidly down the course, it would be a great advantage to the town of Halifax."
Benjamin Hallewell & Company,Woollen Manufacturers,"Moorsfield Works, near Halifax","Our works are situated near to the Calder. Employ 15 hands. Our works are not affected by floods. Obtain supply of water from wells; but do not know the annual consumption at our works. Manufacture yearly 23,000 lbs. of goods, of the value of 3,000l. The whole of the liquid refuse produced at our works is used for irrigation. Do not use any dye wares or bleaching materials. Use yearly 400 gallons of Gallipoli oil, of the value of 100l. Produce about 3,000 lbs. of wool in carding, which is partly sold to hop growers for manure, and to oil extractors. Use steam, 12 nominal horse-power. Consume yearly about 600 tons of coal, the ashes from which are used to fill up low places. The excrements of our workpeople are used for manure. Have no suggestions to offer."
Speak & Normanton,Shoddy Manufacturers,"West Vale, near Halifax","Our works are situated on Blackburn Brook, a tributary of the Calder. Employ 50 hands. Rateable value of works, 880l. The bed of the stream has not silted up. Our works are not affected by floods. The stream is polluted by works above; not by mines. Obtain supply of water from the Deanhead reservoir; but do not know the consumption at our works. Manufacture yearly 234 tons of goods. The whole of the liquid refuse produced at our works flows directly into the stream. Do not use dye wares or bleaching materials. Use 3,582 gallons of oil, of the value of 200l, and brown whale oil of the value of 200l. Do not use any soap, alkali, or urine. Use steam, 25 nominal horse-power. Consume yearly 600 tons of coal; make 100 tons of ashes, which are used for repairing roads. The excrements of our workpeople are used for agricultural purposes. Have no suggestions to offer."
Daniel Sharpe & Sons,Worsted Spinners and Stuff Manufacturers,"Norwood Green, Hipperholm, near Halifax","Our works are situated near to an affluent of the Calder. Employ 60 hands. Rateable value of works, 74l. Our works are not affected by floods. Obtain supply of water from land drainage. Manufacture yearly 29 tons of goods, of the value of 8,000l. The whole of the liquid refuse produced at our works flows into the stream. Do not use any dye wares or bleaching materials, soap, alkali, or urine. Use steam, 10 nominal horse-power. Consume yearly 350 tons of coal, the ashes from which are used to repair roads. The excrements of our workpeople are used for manure. Have no suggestions to offer."
William Barraclough & Sons,Woollen Manufacturers,"Boys and Bottom's Mills, SouthOwram, Halifax","Our works are situated on the Hebble, a tributary of the Calder. Employ 73 hands. Rateable value of works, 431l. The bed of the stream has not silted up. Our works are not affected by floods. The stream is polluted by works above; not by mines. Obtain supply of water from the stream for power only; and for manufacturing purposes from well. Manufacture yearly goods of the value of 15,000l. The whole of the waste liquid produced at our works flows direct into the stream. Do not use any dye wares or bleaching materials. Use yearly, olive and ochre oils, of the value of 240l. The waste wool produced in carding is sold for manure. Do not use any soap. Use yearly, 16 tons of alkali, but no urine. Use both steam and water as power; steam 24, and water 20 nominal horse-power. Consume yearly 700 tons of coals, the ashes from which are used to repair roads. The excrements of our workpeople are partly conveyed into sewers, and thence into the stream, and partly used for manure. Have no suggestions to offer."
M. Bottomley & Son,Worsted Spinners and Manufacturers,"Shelf, near Halifax","Our works are situated near to a tributary of the Calder. Employ 900 hands. Rateable value of works, 799l. 18s. The bed of the stream has not silted up. Our works are not affected by floods. Obtain supply of water jointly from wells and from drainage; but are not able to give the annual consumption at our works. We wash and scour yearly, about 620,000 lbs. of sheep's wool, mohair, and alpaca; and manufacture goods of the value of 18,000l. The whole of the waste liquid produced at our works flows into tanks, and then into the stream. Do not use any dye wares. We use yearly, in the process of manufacture, 8,000 lbs. of sulphur. Use yearly 4,000 gallons of Gallipoli oil, of the value of 900l. Produce no waste wood. Use yearly, soap, 400 packs. The soapsuds are not treated for the recovery of grease. Use yearly, 96 nominal horse-power. Consume yearly, 3,120 tons of coal; make 400 tons of ashes, which are used partly for repairing roads, and the remainder is ground and mixed with lime for making mortar. The excrements of our workpeople are removed from the premises and used for manure. No suggestions to offer."
H. C. Mccrea & Company,Worsted Spinners and Manufacturers,"Lum Brook Mills, Shelf, near Halifax","Our works are situated on the Lum Brook, a tributary of the Calder. Employ 450 hands. Rateable value of works, 580l. The bed of the stream near our works is almost dry, except in very rainy seasons; it has not silted up. Our works are not affected by floods; formerly there was a large volume of water flowing down the stream, but it has been diverted for the stone quarries. The river is not polluted by works above, nor by mines. Obtain supply of water jointly from the river, from wells, and also from reservoirs formed by ourselves for impounding water, cannot give the annual consumption at our works. Manufacture yearly, goods of the value of 160,000l. The whole of the waste liquid produced at our works, except soapsuds, flows direct into the stream, and the effluent water from the soapsuds also flows into the stream. Do not use any dye wares or bleaching materials. Use yearly, 2,000 gallons of olive oil, of the value of about 440l. Use yearly about 150 packs of soap. The soapsuds are sold to a grease extractor, for which we receive 50l. a year. Use yearly, 1,500 tons of coal; the ashes from which are carted away to repair roads. The excrements of our workpeople are removed and used for agricultural purposes. We suggest as the best means of avoiding pollution in future, that liquid and solid refuse from manufacturers and works should be conveyed into settling tanks, and sufficient time allowed for the matters held in suspension to deposit; and by the use of several of these tanks (the liquid flowing from one into the other), seven-eighths of the pollution would, in our opinion, be arrested and prevented from passing into the river or stream. In manufacturers or works where there is little room for the construction of tanks, several millowners or proprietors, whose works are situated on the same stream, might combine together, and settling tanks might be formed below the lowest works to receive the liquid refuse from their several works."
"Firth, Willans, & Company",Carpet Manufacturers,"Clifton Mills, Brighouse","Our works are situated on Clifton Beck, a tributary of the Calder. Employ 350 hands. Rateable value of works, 700l. The bed of the stream has not silted up. Our works are not affected by floods. The stream is polluted by dyeworks alone, not by mines. Obtain supply of water jointly from the stream, wells, and waterworks; and consume yearly about 9,000,000 gallons. Manufacture yearly 9,350 tons of goods, of the value of 70,000l.; bleach 240,000 lbs., print 240,000 lbs., and dye 70,000 lbs. Produce yearly, liquid refuse from washing; 7,150,000; bleaching 250,000; printing, 100,000; dyeing, 750,000; and soapsuds, 750,000 gallons. The soapsuds are treated for the recovery of grease, and the effluent water flows into the stream. Use 10 tons of dye wares yearly, chiefly dyewoods. The spent stuffs are conveyed into the stream. Use yearly as bleaching materials 1 ton of solid brimstone. Use yearly 5 tons of Gallipoli and sperm oils, of the value of £250. Produce yearly 3 tons of waste wood in the process of carding, which are sold for manure. Use yearly, 300 packs, but no alkali or urine. The soapsuds are treated for the recovery of grease, by which we gain £35 a year. Use steam, 35 nominal horse-power. Consume yearly 2,000 tons of coal; make about 100 tons of ashes, which are used for repairing roads. The excernments of our workpeople are used for manure. I have no suggestions to offer as to the best means of avoiding pollution in future, or as to the conservancy of rivers and streams."
Edward Fairburn,Fulling Miller and Card Manufacturer,"Kirklees Mills, Clifton","My mills are situated on the Calder. Employ 24 hands. Rateable value of mills, £239. 2s. 7d. The bed of the river has silted up. My works are affected by floods. The river is seriously polluted by works above, by town sewage, and by mines. Obtain supply of water from the river. If the river from which I derive my supply of water were rendered clean and colourless, the finished goods would be of a very much brighter colour, but I am not able to fix the direct money value. I am not able to state the weight of the various goods fulfilled yearly at my works. The whole of the waste liquid produced at my works flows direct into the river. Do not use any bleaching materials or oil. Use yearly, soap, 3 tons; alkali, 3 tons; but no urine. The soapsuds are not treated for the recovery of the grease. Use water, 15 nominal horse-power. Consume yearly about 100 tons of coal, the ashes from which are mixed with the excrements of my workpeople, and used on my farm. I suggest as the best means of avoiding pollution in future, that manufacturers should be compelled to filter their refuse before allowing it to pass into streams, and that dry earth or ash closets should be used instead of waterclosets."
R. Kershaw & Company,Silk Spinners,"Albert Mill and Calder Bridge Mill, Brighouse","Our works are situated on the Calder. Employ from 200 to 400 hands. Rateable value of Albert mill, £248. 8s. Calder Bridge mill is rented to owner. The bed of the river has silted up. Our works are not affected by floods. There has been no perceptible alteration in the condition of the river within our knowledge. It is very seriously polluted by towns and works above, and is at times as black as ink. Obtain supply of water jointly from the river and from the Halifax Waterworks Company, but are not able to give the annual consumption at our works. Manufacture yearly goods of the value of from £50,000 to £60,000. The whole of the waste liquid produced at our works flows direct into the river. Use yearly 2,500 gallons of orchil and indigo. Do not use any bleaching materials. The waste silk produced is sold for manufacturing purposes. Use yearly 36 tons of dark soap. The soapsuds are not treated for the recovery of the grease. Use steam, 34 nominal horse-power. Consume yearly about 2,000 tons of coal, the ashes from which are given away to those who cart them from our mills. The excrements of our workpeople are used for manure. Have no suggestions to offer."
Wilkinson & Airey,Silk Spinners,"Victoria Mills, Brighouse","Our works are situated on a goit, a tributary of the Calder. Employ 220 hands. Rateable value of works, 336l. Our works are not affected by floods. The river within our knowledge was considerably cleaner than it is at the present time. The river is polluted yearly from that source 500,000 gallons. We might derive our supply of water, were rendered clear and colourless, the water would be still too hard for our purpose. Manufacture yearly 53,000 lbs. of goods, of the value of £40,000. Produce yearly 500,000 gallons of soapsuds. This and the other liquid refuse produced flows into sewers, and then direct into the stream. Do not use any wares, bleaching materials, or oil. Use yearly 22 tons of soap. The soapsuds are not treated for the recovery of the grease. As we rent power from the trustees of the Halifax Joint Stock Banking Company, we are unable to state the nominal horse-power, the quantity of coal consumed, or what is done with the ashes. The excrements of our workpeople are removed in carts and used for manure. We suggest, as the best means of avoiding pollution in future, that the whole of the liquid refuse from manufacturers and town sewage should be utilized, and kept out of rivers and streams."
Benjamin Noble & Company,Silk Spinners,Brighouse,"Our works are situated on the Hebble and Calder navigation. Employ 90 hands. Rateable value of works, 163l. Obtain supply of water from the canal, and consume yearly about 100,000 gallons. Manufacture yearly 25,000 lbs. of goods. Produce yearly liquid refuse in washing 75,000, and soapsuds 25,000 gallons. The whole of the waste liquid produced at our works flows direct into the sewers, and thence into the stream. Do not use any dye wares. Use yearly, 20 gallons of methylated spirits, 15 lbs. of dyeblue; and 9 tons of soap. Use steam, 12 nominal horse-power. Consume yearly 600 tons of coal, the ashes from which are used to repair roads. No suggestions to offer."
J. A. & T. Riley-Brooks,Silk Spinners,"Mod Mill, Clifton Bridge, Brighouse","Our works are situated on a tributary of the Calder. Employ 70 hands. Rateable value of works, 150l. The bed of the river has silted up 3 feet. Our works are affected by floods. The river is polluted by works above and by mines. Obtain supply of water from the stream, and consume yearly 50,000 gallons. Manufacture yearly 50,000 lbs. of goods, of the value of 20,000l. The whole of the waste liquid produced at our works flows direct into the stream. Do not use dye wares or bleaching materials, oil, or soap. Use steam, 20 nominal horse-power. Consume yearly 500 tons of coal, the ashes from which are carted away. The excrements of our workpeople are used for agricultural purposes. No suggestions to offer."
