firm_name,business_type,address,reply
Sugden & Briggs,"Alpaca, Mohair, and Worsted Spinners and Manufacturers","Bowling Mills, Bradford.","Our works are situated on Bowling Beck, an affluent of Bradford Beck, a tributary of the Aire. Employ 860 hands. Rateable value of works, 1,320l. The bed of the stream has not silted up. Our works are not affected by floods. The river is polluted by works above. Obtain supply of water from wells and bore holes; consume yearly 6,000,000 gallons. We manufacture yearly 70,000 lbs. of goods, of the value of 200,000. Produce yearly, liquid refuse, soapsuds, about 1,000,000 gallons; this flows into depositing tanks. The other waste liquid produced at our works flows direct into the sewers. Do not use dye waters or bleaching materials. Use yearly, 2,000 gallons of Gallipoli oil, of the value of 500l. Produce yearly, 6,000 lbs. of waste wool in the process of carding this we sell to waste dealers. Use yearly, 50 tons of the soapsuds that are treated for the recovery of grease, by which we gain 602l. a year. We use steam, 70 nominal horse-power. Consume yearly 3,000 tons of coal; make 360 tons of ashes, which are used partly to fill up hollow places, and to be ground with lime for mortar. The excrements of our workpeople are carted away and used for manure. Have no suggestions to offer."
"Wheater, Smith, Tankard & Company",Worsted and China Grass Spinners,"Alma Works, Sticker's Lane, Bowling, Bradford.","Our works are situated on the Bowling Beck, an affluent of the Bradford Beck, a tributary of the Aire. Employ 140 hands. Rateable value of works, 250l. Our works are not affected by floods. Obtain supply of water collected from gathering ground, but are not able to give the annual consumption of our works. Spin yearly 96,000 lbs. of five, and weave 156,000 lbs. of yarn. The waste liquid produced at our works flows direct into the stream. Do not use any dye waters, bleaching materials, soap, alkali, or urine. Use steam, 17 nominal horse-power. Consume yearly 780 tons of coal, the ashes from which are used to repair roads. The excrements of our workpeople are used for manure. We would suggest, in order to avoid pollution in future, that manufacturers should be compelled to filter their waste liquids before allowing them to flow into the streams."
Bottomley And Houldsworth,Wool Weavers,"Portland Street, Bradford.","Our works are situated on Bowling Beck, an affluent of Bradford Beck, a tributary of the Aire. Employ 250 hands. We hire power from Mr. J. Rawnsley, and cannot give the rateable value of the mill. The river is very much polluted by liquid refuse from works, and the temperature of the water is raised to a very high degree by being frequently used. We manufacture yearly 250,000 lbs. of goods. Do not produce any liquid refuse. Do not use any dye wares, bleaching materials, oil, soap, alkali, or urine. Use steam, 20 nominal horse power. The excrements of our workpeople are deposited in carts and removed in carts to Stanningley, to be there used for manure. Have no suggestions to offer."
Christopher Wand And Company,Worsted Spinning,"Britannia Mills, Bradford","Our works are situated on Bowling Beck, an affluent of Bradford Beck, a tributary of the Aire. Employ 700 hands. Rateable value of works 1,750. The bed of the stream occasionally silts up, but not to any appreciable extent. Our works are not affected by floods by reason of the contraction of the channel of the Beck, where covered over above our works. The condition of the stream becomes seriously affected during the year. It is seriously polluted by town sewage and refuse from dye and other works; it is as noisome as possible, and the temperature of the water is raised, by being constantly used for manufacturing processes to from 80‚àû to 90‚àû Fahrenheit; it is not potable in any degree. Obtain supply of water jointly from wells and from water-works; we consume yearly about 9,000,000 gallons. If the stream from which we might derive our supply of water were rendered clean and colourless, it would be a direct money value to us of 230£ a year. We manufacture yearly about 2,500,000 lbs. of wool of the value of 200,000£. Produce yearly liquid refuse, as soapuds, 1,200,000 gallons; this flows into depositing tanks, but either the waste liquid refuse flows direct into the stream. Do not use other waste liquids or bleaching materials. Use yearly 12 tons of olive oil, of the value of 600£. The whole of the waste wool produced in carding is used for manure. Use yearly, soap 1 ton, alkali 400 cwts, but in time. The soapuds are treated for the recovery of grease. Use steam, 250 nominal horse-power. Consume yearly 4,200 tons of coal; the ashes from the coals are used in making mortar for building purposes; and the remainder is tipped into old quarries, or used as ballast by the railway company. Two-thirds of the excrements of our workpeople are used for manure, and the remainder is cast into the Beck. Have no suggestions to offer."
Demas Ellis & Company,Worsted Spinning,"Dudley Hill, Bradford","Our works are situated on an affluent of the Bradford Beck, a tributary of the Aire. Employ 150 hands. Rateable value of works, 272£. The bed of the stream has not silted up within our knowledge. Our works are not affected by floods. Obtain supply of water from land drainage, but do not know the annual consumption at our works. Manufacture yearly 20,000 lbs. of wool. The whole of the waste liquid produced at our works flows direct to the Beck. Do not use dye wares, bleaching materials, oil, soap, alkali, or urine. Produce yearly waste wool. Use steam, 30 nominal horse-power. Consume yearly 800 tons of coal, the ashes from which are used to repair roads. The excrements of our workpeople are used for manure. No suggestions to offer."
J. O. Greenwood & Company,Worsted Manufacturing,"Bank Foot, Near Bradford","Our works are situated on an affluent of Bradford Beck, a tributary of the Aire. Employ 300 hands. Rateable value of works, 232£. 12s. 6d. Our works are not affected by floods. Obtain supply of water from surface drainage, but do not know the annual consumption at our works. Manufacture yearly goods 55 tons, of the value of 70,000£. The whole of the waste liquid produced at our works flows direct into sewers, and thence into the stream. Do not use dye wares, bleaching materials, oil, soap, alkali, or urine. Use steam, 160 nominal horse-power. Consume yearly 520 tons of coal, the ashes from which are carried on to waste land, and used for filling up hollow places, also for repairing roads. The excrements of our workpeople are used for manure. We suggest as the best means of avoiding pollution in future, that manufacturers and others should be compelled to keep all their refuse out of rivers and streams. No special suggestions to offer as to the conservancy of rivers and streams."
Wilkinson Lund,Worsted and Stuff Manufacturing,"Prospect Mill, Bowling","My works are situated on an affluent of the Bradford Beck, a tributary of the Aire. Employ 48 hands. Do not know the rateable value of works. The bed of the stream has not silted up. My works are not affected by floods. I rent power from Messrs. Cole, Marchants, & Co., and am therefore not able to give the volume of water consumed at my works, the weight of coal used, the ashes made, or what is done with them. I manufacture yearly goods of the value of 1,000£. Do not use any dye wares, bleaching materials, oil, soap, alkali, or urine. The excrements of my workpeople are removed by a contractor to the Bradford Corporation. No suggestions to offer."
George Alderson Smith & Company,Manufacture,"Upper Castle Street, Manchester Road, Bradford","Our works are situated on Bowling Beck, an affluent of Bradford Beck, a tributary of the Aire. Employ 250 hands. Rateable value of works, 491l. The bed of the river has not silted up. Our works are not affected by floods. The Beck is seriously polluted by dye and other works; by sewage; but not by mines. Obtain supply of water from the river, which is pumped to a reservoir and allowed to settle; but it is only used for condensing purposes. Manufacture ready goods of the value of from 60,000l. to 70,000l. We do not produce any liquid refuse at our works. Do not use either dye waters, bleaching materials, oil, soap, alkali, or urine. Use steam, 25 nominal horse-power. Consume yearly about 800 tons of coal, the ashes from which are used for repairing roads. The excrements of our workpeople flow into the sewers, and thence into the river. Have no suggestions to offer."
Robert Wilkinson,Manufacture,"Spring Head Mills, Bradford","My works are situated near an affluent of Bradford Beck, a tributary of the Aire. Employ 100 hands. Do not know the rateable value of the mill. Obtain supply of water from waterworks, and consume yearly 26,000 gallons. Manufacture yearly 120,000 lbs. of goods, of the value of 14,500l. The waste liquid produced at my works flows direct into the sewers, and thence into the stream. Do not use any dyes, bleaching materials, oil, soap, alkali, or urine. Use steam, 12 nominal horse-power, but as I rent power am not able to state the quantity of coal used or what is done with the ashes. The excrements of my workpeople flow by waterclosets into sewers, and thence into the stream. Have no suggestions to offer."
John Rawnsley,Manufacture,"Marshall Mills, Manchester Road, Bradford","My works are situated on a Beck, an affluent of Bradford Beck, a tributary of the Aire. Employ 800 hands. Rateable value of works, 990l. The bed of the stream has silted up. My hands are not affected by floods. The condition of the stream has not changed within the last 10 years. It is polluted by works above, but not by mines. I obtain a supply of water from the reservoirs of Messrs. Edward Piggott, but have never measured the volume consumed at my works yearly. If the stream were rendered clean and colourless it would be of money value to me of 50l. a year. I manufacture yearly 400,000 lbs. of goods, of the value of 60,000l. Produce yearly liquid refuse, as soupads, 200,000 gallons; these flow into depositing tanks, but the other liquid refuse produced flows direct into the river. Do not use dyes or bleaching materials. Use yearly 480 gallons of olive oil, of the value of 120l. Produce yearly 10,000 lbs. of waste wool, in carding, which is sold to clothiers. Use yearly soap, 20,000 lbs. The soapuds are treated for the recovery of grease, by which we gain 20l. a year. Use steam, 55 nominal horse-power. Consume yearly 2,500 tons of coal. Make 250 tons of ashes, which are used to repair roads. The excrements of our workpeople are removed by farmers in the night-time, and used for manure. Have no suggestions to offer."
"Oates, Ingham, & Sons",Dyers of Cotton and Worsted Yarns,"Vale Dye Works, Bradford","Our works are situated on the Bradford Beck, a tributary of the Aire. Employ 600 hands. Rateable value of works, 2342l. The bed of the Beck has silted up, caused by solid and other polluting matter thrown into it. Our works are not affected by floods. It is impossible fitly to describe the fearfully polluted state of this Beck. It has always been within our knowledge, and is now, black and filthy, and is polluted to the fullest extent possible. Obtain supply of water from wells and from the Corporation waterworks, and consume, yearly 96,000,000 gallons. We finish about 800 pieces daily from 6d. to 1s. 6d. per piece. We dye daily 2,500 pieces black, at 1s. per piece; also in slubbing (which is wool already reserved for the spinner) 600 lbs. from 1s. 1d. to 1s. 2d. per lb., and 2,000 lbs. of cotton in various colours at 1s. 0d. to 2s. 6d. per lb. We print daily 240 lbs. of worsted from 1s. 0d. to 1s. 6d. per lb. Produce 52,944,000 lbs. of liquid refuse from washing, printing, and dyeing, which flows direct into the Beck. Use yearly as dye wares, raged wool 1,560,000 lbs., 1,048,320 lbs., fustic 34,736 lbs., pecan 7,876 lbs., chrome 419,328 lbs., chloride of lime 26,480 lbs., sulphuric acid 36 lbs., bromo 53,760 lbs., spirits of salts 26,732 lbs., ammonia 28,033 lbs., aniline 1,376 lbs., extract of indigo 80,572 lbs., cochineal 10,752 lbs., indigo 6,518 lbs., soda ash 79,440 lbs., sulphate of copper 6,376 lbs. The spent woods are burned under our boilers. Use yearly as bleaching materials 26,480 lbs. of chloride of lime, and 79,440 lbs. of soda and bleaching powder. The soapsuds are not treated for the recovery of the grease. Use steam, about 350 nominal horse-power. Consume yearly 24,258 tons of coal, the ashes from which are piled in a heap, and used for building purposes by ourselves, and any one who likes to fetch them. None are put into the stream. The excrements of our workpeople are used as manure. Have no suggestions to offer as to the best means of avoiding pollution in future, or as to the conservancy of rivers and streams."
Edward Ripley & Sons,Dyers and Finishers,"Bowling, Bradford","Our works are situated on the Bowling Beck, an affluent of the Bradford Beck, a tributary of the Aire. Employ 700 hands. Rateable value of works, 1,800l. The bed of the stream is entirely dry for months during the summer above the point where we discharge our liquid refuse into it. Our works are not affected by floods. Obtain supply of water from wells sunk to about 60 yards, from bore-holes below the coal workings, and a small quantity from springs; and consume yearly, 450,000,000 gallons. The whole of the water consumed, viz., 450,000,000 gallons, after being used for dyeing and washing purposes, is discharged into the Beck. We have depositing tanks for our own convenience, and the water they contain is used for condensing purposes at the mills situated below our works. We use yearly from 800 to 900 tons of woods and other solid dye-wares, 400 to 500 tons of alum, 100 tons of potash, soda, sulphate of copper, ammonia, glauber salts, and soap. We also use 400 tons of sulphuric, nitric, and muriatic acids. The soapsuds cannot be separated in our operations, and therefore cannot be treated for the recovery of the grease. Use steam, about 1,000 nominal horse-power. Consume yearly about 21,000 tons of coal, the ashes from which are used principally as ballast for railways. The excrements of our workpeople are collected, and used as manure on land. I do not see how pollution can be avoided in our case, except by stopping our works. Have no suggestions to offer as to the conservancy of rivers and streams, as it is a difficult question to be dealt with."
Benjamin Ingham,Dyer and Bleacher,"Eastbrook Dye Works, Bradford","My works are situated on the East Brook, an affluent of Bradford Beck, a tributary of the Aire. Employ 134 hands. Rateable value of works, 240l. The bed of the stream has not silted up within my knowledge. My works are not affected by floods. The condition of the stream is normal. The stream was in 1865, when I first occupied these works. The stream is polluted by liquid refuse from manufacturers above; not by knowledge by mines. Obtain supply of water jointly from bore-holes, and from waterworks of the Bradford Corporation, which I might derive my supply of water, were rendered clear and colourless, I should not be able to use it profitably, as the supply is uncertain. I bleach and dye yearly 2,500,000 lbs. of goods, of the value of 190,000l. to 200,000l. About one-third of the water used is filtered; but the remainder is only slightly polluted. I have no depositing tanks; the whole of the waste flows direct into the stream. Use yearly 900,000 lbs. of dye woods, drugs, and aniline colours. All the spent stuffs are mixed with the coal and burned. Use yearly as bleaching materials, sulphuric acid, chloride of lime 9,000 lbs.; do not use any oil. Use yearly, soap 500 packs. The soapsuds are treated for the recovery of grease by a recipe, and I receive an equivalent in water. Use steam, 30 nominal horse-power. Consume yearly 3,880 tons of coal, the ashes from which are taken away every day by farmers. The excrements of our workpeople are used for manure. Have no suggestions to offer as to the best means of avoiding pollution in future, or as to the conservancy of rivers and streams."
S. H. Kershaw,Worsted Spinner,"Laister Dyke, Bradford","My works are situated on the East Brook, an affluent of the Bradford Beck, a tributary of the Aire. Employ 350 hands. Rateable value of works, 440l. Obtain supply of water jointly from wells and from waterworks company, but do not know the annual consumption at my works. Manufacture yearly 800,000 lbs. of yarn, of the value of 120,000l. The whole of the waste liquid produced except soaps flows direct into sewers, and thence into the river. Do not use either dye wares or bleaching materials; use yearly 2,400 lbs. of Gallipoli oil, of the value of coal, and about 750 tons; the soapsuds are treated for the recovery of grease, by which I gain 80l. a year. Use steam, 62 nominal horse-power. Consume yearly 2,500 tons of coal; the ashes from which are used to repair roads. The excrements of my workpeople are used for manure. Have no suggestions to offer."
Joseph Jowett,Worsted Stuff Weaver,"Laister Dyke Mills, Bradford","My works are situated on the East Brook, an affluent of Bradford Beck, tributary of the Aire. Employ 7 hands. I hire power from S. H. Kershaw. Manufacture yearly 16,000 lbs. of goods, of the value of £27,000. The whole of the waste liquid produced by us flows direct into the sewers, and thence into the Beck. As I have referred to answers to queries furnished by me as to the horse-power, the weight of coal used, and what is done with the ashes. The excrements of my workpeople are carried away in carts to be used as manure. Have no suggestions to offer."
G. H. Leather,Manufacturing Chemist,"Wharf Street, Bolton Road, Bradford","My works are situated on Bradford Beck, a tributary of the Aire. Employ 16 hands. Rateable value of works, £255. The bed of the stream has silted up, caused by solid refuse thrown into it from works and manufactories. My works are not affected by floods. The Beck is very seriously polluted by every kind of manufacturing refuse, by town sewage, and by mines. Obtain supply of water for wells, and consume yearly about 500,000 gallons. There are at my works three condensing towers, 18 feet high, 2 feet 6 inches wide; 1,000 tons of sulphur, and 923 tons of nitrate of soda. Produce yearly 2,600,000 lbs. vitriol sp. gr. 1.720, and 862,600 lbs. sp. gr. 1.845; also aquatortis 4,266 lbs. sp. gr. 1.160, and 2,441 lbs. sp. gr. 1.320. Do not produce any liquid refuse. Use yearly 1,470 tons of coal; the ashes produced at my works are used to repair roads. The excrements of my workpeople are used for manure. Have no suggestions to offer as to the best means of avoiding pollution in future, or as to the conservancy of rivers and streams."
Samuel Sutcliffe,Cotton Spinners,"Valley Road, Bradford","Our works are situated on Bradford Beck, a tributary of the Aire. Employ 280 hands. Rateable value of works, £2,202. The bed of the stream has silted up, caused by solid and liquid refuse thrown into it from manufactories and works. Our works are slightly affected by floods. The condition of the river has been most foul, and seriously polluted. Obtain supply of water from springs, and in very dry weather from the Corporation waterworks; but have no means of ascertaining the volume used yearly in our works. We manufacture 520,000 lbs. of goods (spinning and doubling). The whole of the liquid refuse produced at our works flows direct into the river. Do not use either soap, alkali, or urine. Use steam, 160 nominal horse-power. Consume yearly 4,200 tons of coal, the ashes from which are used for levelling land and repairing roads. The excrements of our workpeople are cast into the Beck. No suggestions to offer."
"Critchley, Armstrong & Company",Cotton and Worsted Manufacturers,"Holdsworth Street, Bradford","Our works are situated on Bradford Beck, a tributary of the Aire. Employ 130 hands. Rateable value of works, £400. The bed of the stream opposite our works is paved; our works are affected by floods, owing to the contraction of the river channel. The river is polluted to a serious extent by refuse from woollen manufacturers, dye and bleach works, and by town sewage. Obtain supply of water jointly from wells and from waterworks, but do not know the annual consumption at our works. Manufacture yearly 109,508 lbs. of goods, of the value of £16,426. The waste liquid produced at our works flows direct into the stream. Use steam, 20 nominal horse-power. Consume yearly 800 tons of coal; the ashes from which are carted away from our premises. The excrements of our workpeople flow into the beck. Have no suggestions to offer."
S. Townshend ,"Cotton, Hank, Printer, Winder, and Warper","Albert Mill, Miller's Gate, Bradford","My works are situated on Bradford Beck, a tributary of the Aire. Employ 40 hands. Rateable value of works, £150. The bed of the stream has not silted up opposite my works. My works are not affected by floods. The Beck is arched over near the works and is very much polluted by works above. Obtain supply of water from the Bradford Corporation Waterworks, and consume yearly about 800,000 gallons. If the stream from which we might derive our supply of water were rendered clear and colourless, it would be a direct yearly value to me of 30/-. I print yearly 70,000 lbs. of yarn, the value of £12,000. The whole of the waste liquid produced at our works flows direct into the sewers, and thence into the Beck. Use yearly as dye liquor, 5,000 lbs.; iron and red liquor, 200 lbs.; and 800 lbs. yearly bleaching materials; chloride of lime, 1,680 lbs.; soda ash, 560 lbs.; vitriol, 2,000 lbs. Do not use any soap, or urine, but yearly, alkali, a quarter of a ton. Use steam, 2 nominal horse-power. Consume yearly 15 tons of coal, the ashes from which are used in the streets. The excrements of my workpeople are conveyed into sewers, and thence into the river. Have no suggestions to offer."
"Gledhill, Ashworth & Company",Sizer,"Gordon Street, Bradford","Our works are situated on Bowling Beck, a tributary of the Aire. The bed of the Beck has not silted up. Our works are not affected by floods. The condition of the stream has not changed within our knowledge; it is polluted by works above, but not by mines. Obtain our supply of water from waterworks, and we know the annual consumption at our works. We size yearly about 300 tons of goods, and we produce at our works flows direct into sewers, and thence into the Beck. Use steam, 16 nominal horse-power. Consume yearly 900 tons of coal, the ashes from which are carted away to various places where we can tip them. The excrements of our workpeople are conveyed by waterclosets into sewers, and thence into the stream. Have no suggestions to offer."
James Walker,Sizer,"Thornton Road, Bradford","Our works are situated on Bradford Beck, a tributary of the Aire. Employ 12 hands. The Beck has not silted up opposite our works. Our works are not affected by floods. The condition of the stream is much the same as it has been for many years. It is very seriously polluted by refuse from dye houses, woollen, and other manufactories. Obtain supply of water from the Bradford Corporation waterworks, and consume yearly 1,090,000 gallons. We, yearly, size goods of the value of from 4,000 to 5,000. The whole of the waste liquid produced at our works flows direct into the stream. Use yearly from 500 to 600 sacks of flour as size; but do not use either oil or soap. Use steam, 10 nominal horse-power. Consume 864 tons of coal, the ashes from which are used partly in paving the roads and mortar. The excrements of our workpeople are cast into sewers and thence into the river. We suggest, as the best means of avoiding pollution in future, that all liquid refuse should be purified before being allowed to pass into rivers and streams."
Titus Gankroger,Sizer,"Spring Mill Street, Bradford","My works are situated on Bradford Beck, a tributary of the Aire. Employ 16 hands. The bed of the stream has not silted up near our works. Our works are not affected by floods. The stream is very seriously polluted by works above, not by mines. Obtain supply of water from the reservoir of Messrs. Edward Ripley and Sons. Size yearly 400,000 lbs. of wraps. Use yearly 300 sacks of flour as size, but do not use either oil or soap. The liquid refuse produced at my works flows direct into the Beck. Use steam, 16 nominal horse-power. Consume 1,000 tons of coal, the ashes from which are carted away. Have no suggestions to offer."
John Mills,Sizer,"Fulton Street, Thornton Road, Bradford","My works are situated on a gill that flows into Bradford Beck, a tributary of the Aire. Employ 7 hands. The bed of the gill is very much silted up with solid and liquid refuse and spent dye stuffs. My works are affected by floods, but not to any serious extent. The gill is getting gradually worse year by year; it is seriously polluted by entry of liquid and solid refuse. Obtain supply of water from the Bradford Waterworks Company. If the water of the gill was rendered clear and colourless, it would be worth, in direct money value to me, 20l. a year. I size 539,760 lbs. of wraps yearly. The whole of the liquid refuse produced at my works flows into the stream. Use yearly, in the preparation of size, 300 sacks of wheat and flour. Do not use any clay. Do not use either oil or soap. Use steam, 8 nominal horse-power. Consume yearly 600 tons of coal, the ashes from which are used as ballast on railways. The excrements of my workpeople are mixed with stable manure, are used as manure. No suggestions to offer."
