firm_name,business_type,address,reply
William Shaw & Sons,Woollen Manufacturers,Longwood,"Our works are situated on the Longwood Brook, a tributary of the Calder. Employ 240 hands. Rateable value of works, 703l. The bed of the stream has silted up. Our works are not affected by floods. The condition of the river formerly was clean; it is exceedingly filthy and polluted by refuse turned into it from works above, but not by mines. Obtain supply of water from the stream, and consume yearly 10,088,000 gallons. As we have had to incur an expense of 300l. in constructing works to clean water to our mills for manufacturing purposes, the cleansing of the river would not be of any direct money value to us. Manufacture yearly 2,000 packs of wool, of the value of 30,000l. The whole of the liquid refuse produced at our works, except soapuds, flows direct into the river. Use yearly 40,000 lbs. of dye wares, chiefly dyewoods. The spent dye stuffs are turned into the stream. Do not use any bleaching materials. Use yearly 30 tons of olive oil, of the value of 1,500l. A portion of the waste wool produced in carding is worked over again; the remainder is sold to oil and grease extractors. Use yearly, soap 12 tons; alkali 4 tons; urine, 12 tons; and ammonia, 6 tons. The soapuds are treated for the recovery of the grease, by which we gain 601. a year. Use steam, 40 nominal horse-power. Consume yearly 1,700 tons of coal, the ashes from which are partly used in repairing roads, partly ground and mixed with lime for mortar, and partly turned into the river. The excrements of our workpeople are used for manure. Have no suggestions to offer."
Benjamin Hall,Woollen Manufacturer,"Hirst Mill, Longwood","My works are situated on a small stream, a tributary of the Calder. Employ 30 hands. Rateable value of works, 128l. The bed of the stream has not silted up. My works are not affected by floods. There has been no alteration in the condition of the stream during the last twenty-four years. It is not polluted by works above, nor by mines. Obtain supply of water jointly from the stream and springs, but do not know the annual consumption at my works. Manufacture yearly goods of the value of 10,000l. The whole of the waste liquid produced at my works flows direct into the stream. Use yearly as dye wares, logwood 8,960 lbs., and R. V. 560 lbs., and urine 560 lbs. The spent dye wares are thrown into the stream. Do not use any bleaching materials. Use yearly 4 tons of olive oil, of the value of 200l. The whole of the waste wool produced in carding is used for manure. Use yearly, soap 3,360 lbs., alkali 7,280 lbs., and urine 20,000 gallons. The soapuds are treated for the recovery of the grease. Use both steam and water as power; steam 8, and water 8 nominal horse-power. Consume yearly 500 tons of coal, the ashes from which are used to repair roads. The excrements of my people are used for manure. I suggest, as the best means of avoiding pollution in future, that all solid and liquid refuse from manufactories, mills and works, also town sewage, should be kept out of rivers and streams."
Abraham Hall,Sealskin and Mohair Manufacturer,"Quarmby Mill, near Huddersfield","My works are situated near an affluent of the Calder. Employ 40 hands. Rateable value of works, 130l. Obtain supply of water from wells; but do not know the annual consumption at my works. Manufacture yearly goods of the value of 20,000l. The whole of the liquid refuse produced at my works flows direct into the stream. Do not use any dye wares or bleaching materials. Use yearly 2,800 gallons of olive oil, of the value of 416l. The whole of the waste wool produced in carding is sold. Do not use either soap, alkali, or urine. Use steam, 8 nominal horse-power. Consume yearly 350 tons of coal, the ashes from which are used to repair roads. The excrements of my workpeople are used for manure. Have no suggestions to offer."
Edward Hirst & Son,Dye Works,"Wildspur Mill, New Mill, Huddersfield"," Our works are situated on the New Mill Brook, a tributary of the Calder. Employ 104 hands. Rateable value of works, 440l. 15s. The bed of the stream has not silted up. Our works are not affected by floods. The condition of the stream has not changed, to our knowledge, within the last 20 years. It is polluted by works above; not by mines. Obtain supply of water partly from a gathering ground, and partly from the stream; but are not able to state the annual consumption at our works. Manufacture yearly 62 tons of goods for the value of 19,000l. The whole of the waste liquid produced at our works flows direct into the stream. Use yearly as dye ware, logwood, Sander's wood, and barwood, bi-chrome, sumac, copperas, and others. The spent dye stuffs are burned. Do not use any bleaching materials. Use yearly Gallipoli oil, of the value of 600l. The whole of the waste wool produced in carding is sold to farmers for manure. Use yearly, soap 5 tons. The soap suds are not treated for the recovery of the grease. Use both steam and water as power; steam 30, and water 10 nominal horse-power. Consume yearly 1,250 tons of coal, the ashes from which are used partly for repairing roads, and partly to be ground and mixed with lime for mortar. The excrements of our workpeople are used for manure. Have no suggestions to offer."
Charles Lockwood,Woollen Works,"New Mill, near Fancy Woollen Huddersfield","My works are situated on the New Mill Brook, a tributary of the Calder. Employ 262 hands. Rateable value of works, 523l. The bed of the stream has silted up. My works are not affected by floods. The condition of the stream has not changed, to my knowledge, within the last 13 years. It is seriously polluted by works above, and by mines. Obtain supply of water jointly from stream, from wells, and boreholes, but cannot state the annual consumption at my works. Manufacture yearly goods of the value of 30,000l. The whole of the liquid refuse produced at my works flows direct into the stream. Use yearly, 30 tons of dye wares; chiefly logwood, wood, camwood, barwood, and fustic. The whole of the spent dye stuffs are either burned or turned into the river. Do not use any bleaching materials. Use yearly 25 tons of olive and Gallipoli oil. The whole of the waste wool produced at my works in carding is either sold or used for manure. Use yearly, soap 8 tons, and an unknown quantity of urine, all we can get. The soap suds are treated for the recovery of the grease, by which I gain about one-third of the cost of the oil and soap. Use both steam and water as power; steam 40, and water 80 nominal horse-power. Consume yearly 1,600 tons of coal, the ashes from which are used for repairing roads. The excrements of my workpeople are used for manure. Have no suggestions to offer."
Benjamin John Hey,Dye Works,"Turnbridge, Huddersfield","Our works are situated near to the Colne, a tributary of the Calder. Employ 15 hands. Rateable value of works, 73l. The bed of the stream has silted up, caused by the throwing in of rubbish from excavated foundations, and also ashes. Our works are not affected by floods. Fifty years ago the river was comparatively pure, with plenty of fish in it, but fish are no longer able to live in the water. The river is very considerably polluted by all kinds of refuse from works, and by mines. Obtain supply of water from the canal, from wells, and boreholes; and consume yearly 15,650,000 gallons. If the river, from which we might derive a supply of water, were rendered clear and colourless it would be a direct money value to us of 1,400l. A year. We dye yearly 240,000 lbs. of goods, of the value of 70,000l. The whole of the waste liquid produced at our works flows direct into sewers, and thence into the stream. Use yearly 190,314 lbs. of dye wares; chiefly logwood, fustic, barwood, Sander's wood, peachwood, sumac, and others. The spent dye stuffs are burned. Do not use any bleaching materials, oil, soap, or urine. Use yearly, soda 2,782 lbs. Use steam, 6 nominal horse-power. Consume yearly 982 tons of coal, the ashes from which are used to repair roads. The excrements of my workpeople are used for manure. Have no suggestions to offer."
Josiah Atkinson,Dyewood Cutter and Dyer,"Bradley Mills, Huddersfield","My works are situated on the Colne, a tributary of the Calder. Employ 5 hands. Rateable value of works, 100l. The bed of the river has silted up, caused by solid refuse thrown into it from the foundations of new houses in the town. My works are affected by floods. Forty years ago the stream was clear; it is now as black as ink, being polluted to a considerable extent by works above, and by mines. Obtain supply of water from the stream; and consume yearly 62,000 gallons. If the river, from which I obtain my supply of water, were rendered clear and colourless, it would be a direct money value to me of 25l. a year. I dye yearly, 124,000 lbs. of goods. The whole of the waste liquid produced at my works flows into the river. I dye yearly 10 tons of dye wares, chiefly logwood, sapan, myrobalans, bi-chrome, oxide of tin. The spent liquors flow into river. I cut and prepare yearly 642 tons of dyewoods. Use water as power, 14 nominal horse-power. The excrements of my workpeople are carted away for manure. Have no suggestions to offer."
John Scofield & Son,Woollen Manufacturers,"Commercial Mills, Firth Street, Huddersfield.","Our works are situated near the Colne, a tributary of the Calder. Employ from 300 to 400 hands. Rateable value of works 844l. 6s. The bed of the river has silted up, caused by solid refuse thrown into it. Our works are not affected by floods. The condition of the river has during the last few years been very polluted, and is gradually getting worse. It is not only polluted by works above, but by mines. Obtain supply of water from the London and North-western canal, and consume yearly 18,000,000 gallons. Manufacture yearly goods of the value of 60,000l. The whole of the waste liquid produced at our works flows into sewers, and thence into the river. Use yearly 350,000 lbs. of dye wares; principally logwood, Sander's wood, and fustic. The spent dye stuffs are burned. Do not use any bleaching materials. Use yearly 20 tons of olive oil, of the value of 900l. Produce yearly 30 tons of waste wool in the process of carding, which is sent to oil extractors. Use yearly, soap 40 tons, alkali 14 tons, liquid ammonia 70 tons, and urine 100 tons. The soapuds are treated for the recovery of the grease, by which we gain 120l. a year. Use steam, 60 nominal horse-power. Consume yearly 2,500 tons of coal, the ashes from which are partly used for repairing roads, and partly ground and mixed with lime for mortar. The excrements of our workpeople are removed by a contractor under the Corporation. Have no suggestions to offer."
Edward Fisher & Company,Spinners of Silk Waste,"Longroyd Mills, Longroyd Bridge, Huddersfield.","Our works are situated on the Colne, a tributary of the Calder. Employ 200 hands. Rateable value of works, 900l. The bed of the river has, and is, silting up. Our works are affected by floods. The river is very seriously polluted by works above, and by mines. Obtain supply of water from the river and canal, but do not know the annual consumption at our works. As we only use the river water for steam-boiler purposes the pollution of it makes but little difference to us. Spin yearly about 90,000 lbs. of silk waste goods, of the value of 30,000l. The whole of the liquid refuse produced at our works flows directly into the sewers, and thence into the river. Do not use any dye wares, bleaching materials, oil, alkali, or urine. Use yearly soap of the value of 250l. The soapuds are treated for the recovery of grease. Use steam and water as power, steam 30, and water 20 nominal horse. Consume yearly coal of the value of 500l., the ashes from which are partly used for repairing roads, and as ballast for railways. The excrements of our workpeople are removed and used for manure. Have no suggestions to offer."
James Shaw,Woollen Manufacturer,"Victoria Mills, Huddersfield.","My works are situated on the Holme, a tributary of the Calder. Employ 150 hands. Rateable value of works, 636l. The bed of the river has silted up, caused by solid refuse and ashes thrown into it. My works are affected by floods. The river is very seriously polluted by works above, and by mines. Obtain supply of water jointly from the stream and wells; but I am not able to give the annual consumption at my works. If the river were rendered clear and colourless it would be of considerable money value to me; but I cannot give the amount. Manufacture yearly 25,000 lbs. of wool and dye goods of the value of 10,000l. The whole of the waste liquid, except soapuds, flows direct into the river. Use yearly 18,600 lbs. of dye wares, chiefly logwood. The spent dyestuffs are burned. Do not use any bleaching materials. Use yearly 20 tons of olive oil, of the value of 1,300l. Produce yearly 18,000 lbs. of wool waste in the process of carding, which is sold, but no urine. The soapuds are treated for the recovery of the grease, by which I gain yearly 157l. Use steam, 60 nominal horse-power. Consume yearly 1,520 tons of coal, the ashes from which are used for repairing roads. The excrements of my workpeople are used for manure. Have no suggestions to offer."
"Henry Hirst, Junior, & Company",Woollen Manufacturers,"Turnbridge Mills, Huddersfield","The mills in which we rent room and power are situated on the Colne, a tributary of the Calder. Employ 60 hands. We pay for rent of works and power 900l. a year. The bed of the stream has silted up, caused by solid refuse thrown into it. The mills are not affected by floods. The condition of the river within our knowledge has very considerably deteriorated. It was formerly clear, and abounded with fish; it is now as black as ink, and fish are unable to live in it. It is polluted by works above; not by mines. Obtain supply of water from canal, but are not able to state the annual consumption at our works. Manufacture yearly 312,000 lbs. of goods of the value of 16,881l. The whole of the waste liquid produced at our works flows direct into sewers, and thence into the stream. Do not use any dye works or bleaching materials. Use yearly 20 tons of Gallipoli oil, of the value of 1,200l. The whole of the waste wool produced in the process of carding is sold to waste dealers. Do not use any soap, alkali, or urine. As we rent room and power, are not able to state the nominal horse-power employed, the quantity of coals consumed, or what is done with the ashes. The excrements of our workpeople are removed by a contractor under the Corporation. We suggest, as the best means of avoiding pollution in future, that ashes and other solid refuse from mills, factories, and works should be prohibited from being turned into rivers and streams."
Henry Lister & Company,Woollen Manufacturers,"Ashbrow Mills, Huddersfield","Our works are situated on a tributary of the river Calder. Employ 73 hands. Rateable value of works, 362l. 16s. The bed of the stream has not silted up. Our works are not affected by floods. The condition of the stream has not changed under our knowledge. It is polluted by works above; not by mines. Obtain supply of water partly from the stream, wells, and land drainage; and consume yearly 10,920,000 gallons. The condition of the stream cannot be better than it is, except at the time of a fresh or a flood, when it is seriously polluted by the washings from roads. We spin yearly 104,000 lbs. of yarn, finish 832,000 lbs., and manufacture 10,000 lbs. of the value of 64,533l. The whole of the liquid refuse produced at our works is drained through earthenware pipes on to land adjacent to our works; and is therefore filtered through earth varying from 25 yards to 100 yards before going into the stream. Do not use any dye works or bleaching materials. Use yearly 1,164 gallons of olive oil, of the value of 216l. Produce yearly 10,400 lbs. of waste wool in the process of carding, which are sold for manure. Use yearly about 6 cwt. of soap. Use the nominal horse-power. Consume yearly 832 tons of coal; make about 104 tons of ashes, which are partly ground and mixed with lime and mortar, and partly used for repairing roads. The excrements of our workpeople with the refuse from scribbling and carding, and the short flocks from the finishing process, are used for manure. We suggest, as the best means of avoiding pollution in future, that all liquid refuse from mills, dye houses, and manufactories should be filtered before being allowed to flow into streams, and that waterclosets should be abolished, and earth-closets adopted."
John Brooke & Sons,Woollen Manufacturers,"Armitage Bridge, Huddersfield","Our works are situated on the river Holme, a tributary of the river Calder. Employ 530 hands. Rateable value of works, 1,689l. 15s. The bed of the river has silted up above and below us, but not opposite our works. Our works are not affected by floods. The river within our knowledge has always been a dirty stream, but it has gradually become worse year by year. It is polluted to a very great extent by works above, and by mines. Obtain supply of water from the river for condensing purposes; and from wells and boreholes and a pure stream which flows through our premises for manufacturing purposes; and consume yearly about 150,000,000 gallons. We manufacture and dye yearly 597,229 lbs. of wool, and produce 341,000 lbs. of cloth, of the value of 120,000l. Produce 78,000 gallons of liquid refuse from washing, 4,000,000 from dyeing, and 67,000,000 from soap suds. The whole of the liquid produced at our works, except soap suds, flows direct into the river. Use as regards dyeing and dye woods, and are not able to give the quantity used yearly. Use yearly 60 tons of olive oil, of the value of 3,300l. Produce yearly 18 tons of waste, which is used for manufacturing low-priced oils, urine, and soap. The excrements are treated for the recovery of the oil, and we gain yearly 100l. Use steam water and water as power; use 10, and water 150 nominal horse-power. Consume yearly 5,000 tons of coal; make about 700 tons of ashes, which are used for various purposes, and none have been put into the river since 1866. The excrements of our workpeople are used for manure. We suggest, as the best means of avoiding pollution in future, that it should be declared illegal to turn any solid or liquid refuse into rivers and streams."
George Crossland & Sons,Woollen Manufacturers,"Crossland Moor Mills, and Lockwood Mills, Huddersfield","Our works are situated on the Colne and Holme, tributaries of the Calder. Employ from 400 to 500 hands. Rateable value of works, 2,500l. The bed of the stream has silted up. Our works are not affected by floods. There has been an alteration in the condition of the streams within our knowledge. They are polluted by works above, and by mines. Obtain supply of water jointly from the river, from wells, boreholes, and from Canal Company; and consume yearly, about 6,000,000 gallons. Manufacture yearly from 200 to 250 tons of goods, of the value of 80,000l. Produce yearly, liquid refuse from washing 4,200,000 gallons, from dyeing 1,800,000 gallons, the whole of which, except the soapsuds, flows direct into the river. Use yearly, 200,000 lbs. of dye ware's; chiefly argol, logwood, fustic, camwood, Sander's wood, shumac, barwood, bi-chrome, madder, alum, coppers, cochineal, oxide of tin, nitrate of tin, and aniline dyes. Do not use any bleaching materials. Use yearly 10,000 gallons of olive oil, of the value of 2,000l. Produce yearly in the process of carding 15 tons of waste wool, which is sold. Use yearly, soap 26 tons, alkali 25 tons, and urine 105,000 gallons. The soapsuds are treated for the recovery of the grease, by which we gain yearly 451l. Use steam yearly 1,500 tons of coal, the ashes from which are deposited in an old stone quarry. The excrements of our workpeople are conveyed by waterclosets into the river. Have no other means to offer."
Benjamin Crosland & Sons,Woollen and Mohair Manufacturers,"Oakes Mills, Lindley, Huddersfield","Our works are situated on the Colne, a tributary of the Calder. Employ 90 hands. Rateable value of works, 310l. Our works are not affected by floods. Obtain supply of water from the waterworks company, and consume yearly 6,000,000 gallons. Manufacture yearly, 124,000 lbs. and dye 50,000 lbs. of goods. The whole of the liquid refuse produced at our works, except soapsuds, flows direct into the river. Use yearly, 18,000 lbs. of dye wares, chiefly logwood, Sander's wood, shumac, and bi-chrome. The spent dye stuffs are burned. Do not use any bleaching materials. Use yearly, 12 tons of Gaillopil and olive oil, of the value of 600l. The whole of the waste wool produced in carding is used over again. Use yearly, soap, 7 tons, alkali 2 tons, and urine 21,000 gallons. The soapsuds are treated for the recovery of grease, by which we gain 181l. a year. Use steam, 16 nominal horse-power. Consume yearly, 1,000 tons of coal, the ashes from which are used for the repair of roads. The excrements of our workpeople are used for manure. We suggest as the best means of avoiding pollution in future, that all solid waste should be kept out of rivers and streams. We are of opinion that the chemicals used in dyeing act as deodorizers, and if it were not for the waste water from mills supplied by reservoirs, the state of the rivers would be much worse in summer in manufacturing districts than they are at present."
Armitage Brothers,Woollen Manufacturers,"Milnbridge, Huddersfield","Our works are situated on the Colne, a tributary of the Calder. Employ 255 hands. Rateable value of works, 847l. 9s. The bed of stream has silted up from 18 inches to 2 feet, caused chiefly by ashes and other solid refuse thrown into it. Our works are not affected by floods. The river is very considerably polluted, chiefly by refuse from chemical works; not by mines. Obtain supply of water jointly from springs, river, and canal. If the stream from which we might derive a supply of water were rendered clear and colorless, it would be of considerable money value to us; but we are not able to fix the amount. Manufacture yearly 60,000 lbs. The whole of the liquid refuse produced at our works, except soapsuds, flows direct into the river. Use yearly 18 tons of Gaillopil, oil of the value of 1,440l. Produce yearly about 8 tons of waste wool in the process of carding, which is sold to oil and grease. Use yearly, soap 13,000 lbs. The soapsuds are treated for the recovery of the grease, by which we gain 454l. a year. Use both steam and water as water, about 6 nominal horse-power. Consume yearly 2,600 tons of coal, the ashes from which are partly used for repairing roads, and ground to be mixed with lime for building purposes. The excrements of our workpeople are sold to farmers for manure. We suggest as the best means of avoiding pollution in future, that no solid refuse should be allowed to be thrown into rivers and streams. Have no suggestions to offer as to the conservancy of rivers and streams."
Joseph Dyson & Sons,Woollen Cloth Manufacturers,Huddersfield,"Our works are situated on the Colne, a tributary of the Calder. Employ 200 hands. Rateable value of works, 465l. Our works are not affected by floods. The river is polluted by works above; not by mines. Obtain supply of water from the canal; but do not know the annual consumption at our works. Manufacture and dye yearly 162 tons of goods, of the value of £40,000. The whole of the waste liquid produced at our works flows direct into the river. We use yearly 5,000 lbs. of dye wares, chiefly logwood. The spent dye stuffs are either burned or used for manure. Do not use any bleaching materials. Use yearly 30 tons of olive oil, of the value of £1,500. The whole of the waste wool produced in the process of carding is partly sold to oil and grease extractors, and partly used over again. Use yearly, soap, 6Œ© tons; soda crystals, 12 tons; urine, 200 tons; and ammonia, 3 tons. The soapuds are not treated for the recovery of the grease. Use steam, 43 nominal horse-power. Consume yearly 1,500 tons of coal; the ashes from which are deposited on our land to be afterwards used for repairing roads. The excrements of our workpeople are conveyed by water closets into sewers, and thence into the river. Have no suggestions to offer as to the means of avoiding pollution in future, or as to the conservancy of rivers and streams."
